[{"algorithm":"Ed25519","apiVersion":"modos.pleiades/v1alpha1","artifactDigest":"sha256:5555555555555555555555555555555555555555555555555555555555555555","artifactRef":"urn:pleiades:receipt:grant-proposal:synthetic-0001","attestationId":"attestation:synthetic:authorityGrant:v1","authority":{"attestationOnly":true,"authorizationApplied":false,"executionApplied":false},"candidateDigest":"sha256:63f923727ca0ab01a2ab4b07232c45e94097d5b3628bedd69d1914e5f31889f3","classification":"sovereign-decision","expiresAt":"2026-07-21T23:05:00Z","inputId":"authorityGrant","issuedAt":"2026-07-20T23:05:00Z","issuerRef":"human:synthetic-steward","keyRef":"key:synthetic-steward-v1","kind":"EvidenceAttestation","nonce":"0000000000000000000000000000000000000000000000000000000000000001","receiptDigest":"sha256:6666666666666666666666666666666666666666666666666666666666666666","signatureBase64":"EoNlARxA4lMJPohHYOLt+CeXIkWFhPpL7H6cu/D+VtGBF+0ofIlmue7Cn5p/M7LxUOk+3Qxf/G3vI4mNc2FtBQ=="},{"algorithm":"Ed25519","apiVersion":"modos.pleiades/v1alpha1","artifactDigest":"sha256:7777777777777777777777777777777777777777777777777777777777777777","artifactRef":"urn:pleiades:artifact:canary-plan:synthetic-0001","attestationId":"attestation:synthetic:canaryPlan:v1","authority":{"attestationOnly":true,"authorizationApplied":false,"executionApplied":false},"candidateDigest":"sha256:63f923727ca0ab01a2ab4b07232c45e94097d5b3628bedd69d1914e5f31889f3","classification":"live-evidence","expiresAt":"2026-07-21T00:20:00Z","inputId":"canaryPlan","issuedAt":"2026-07-20T23:20:00Z","issuerRef":"service:synthetic-live-evidence","keyRef":"key:synthetic-live-evidence-v1","kind":"EvidenceAttestation","nonce":"0000000000000000000000000000000000000000000000000000000000000002","receiptDigest":"sha256:8888888888888888888888888888888888888888888888888888888888888888","signatureBase64":"YAIKezAasSuU4HQjzAabw89GCeJnnqhmmhdY4DAMTOV+l+87bUrB0/do/HmPCvffIm7lYb15sgb+unYSgUXNCw=="},{"algorithm":"Ed25519","apiVersion":"modos.pleiades/v1alpha1","artifactDigest":"sha256:3333333333333333333333333333333333333333333333333333333333333333","artifactRef":"urn:pleiades:receipt:history-decision:synthetic-0001","attestationId":"attestation:synthetic:historyDecision:v1","authority":{"attestationOnly":true,"authorizationApplied":false,"executionApplied":false},"candidateDigest":"sha256:63f923727ca0ab01a2ab4b07232c45e94097d5b3628bedd69d1914e5f31889f3","classification":"sovereign-decision","expiresAt":"2026-07-21T23:05:00Z","inputId":"historyDecision","issuedAt":"2026-07-20T23:05:00Z","issuerRef":"human:synthetic-steward","keyRef":"key:synthetic-steward-v1","kind":"EvidenceAttestation","nonce":"0000000000000000000000000000000000000000000000000000000000000003","receiptDigest":"sha256:4444444444444444444444444444444444444444444444444444444444444444","signatureBase64":"8U49UURqqmFaxu2tEfKksqDy3nReKq8nnp5FdsDrtDs+uFvxe+Ug6pBxbhssELnRkoOb+ZMizLnSvcqZeqcvCQ=="},{"algorithm":"Ed25519","apiVersion":"modos.pleiades/v1alpha1","artifactDigest":"sha256:eeeeeeeeeeeeeeeeeeeeeeeeeeeeeeeeeeeeeeeeeeeeeeeeeeeeeeeeeeeeeeee","artifactRef":"urn:pleiades:artifact:nodes:synthetic-0001","attestationId":"attestation:synthetic:nodeInventory:v1","authority":{"attestationOnly":true,"authorizationApplied":false,"executionApplied":false},"candidateDigest":"sha256:63f923727ca0ab01a2ab4b07232c45e94097d5b3628bedd69d1914e5f31889f3","classification":"live-evidence","expiresAt":"2026-07-21T00:20:00Z","inputId":"nodeInventory","issuedAt":"2026-07-20T23:20:00Z","issuerRef":"service:synthetic-live-evidence","keyRef":"key:synthetic-live-evidence-v1","kind":"EvidenceAttestation","nonce":"0000000000000000000000000000000000000000000000000000000000000004","receiptDigest":"sha256:ffffffffffffffffffffffffffffffffffffffffffffffffffffffffffffffff","signatureBase64":"BONPcjHXTO5Nf/78iBAtMBTeqwPk+PSTheORXy5spoja5zlcCUyYuBx2T1CC/SByzd75gWbDSzOY3rZr+46FAA=="},{"algorithm":"Ed25519","apiVersion":"modos.pleiades/v1alpha1","artifactDigest":"sha256:9999999999999999999999999999999999999999999999999999999999999999","artifactRef":"urn:pleiades:artifact:observation-plan:synthetic-0001","attestationId":"attestation:synthetic:observationPlan:v1","authority":{"attestationOnly":true,"authorizationApplied":false,"executionApplied":false},"candidateDigest":"sha256:63f923727ca0ab01a2ab4b07232c45e94097d5b3628bedd69d1914e5f31889f3","classification":"live-evidence","expiresAt":"2026-07-21T00:20:00Z","inputId":"observationPlan","issuedAt":"2026-07-20T23:20:00Z","issuerRef":"service:synthetic-live-evidence","keyRef":"key:synthetic-live-evidence-v1","kind":"EvidenceAttestation","nonce":"0000000000000000000000000000000000000000000000000000000000000005","receiptDigest":"sha256:aaaaaaaaaaaaaaaaaaaaaaaaaaaaaaaaaaaaaaaaaaaaaaaaaaaaaaaaaaaaaaaa","signatureBase64":"IIY6OlE0SLUNqhdSVrBegDXW0pyAUluFGx+D6jyMlUZ/8KiwLtHR+ly2F2oQu9sHrle5Rl6hRGvqypg4K8FFDQ=="},{"algorithm":"Ed25519","apiVersion":"modos.pleiades/v1alpha1","artifactDigest":"sha256:cccccccccccccccccccccccccccccccccccccccccccccccccccccccccccccccc","artifactRef":"urn:pleiades:private:inventory:synthetic-0001","attestationId":"attestation:synthetic:observedInventory:v1","authority":{"attestationOnly":true,"authorizationApplied":false,"executionApplied":false},"candidateDigest":"sha256:63f923727ca0ab01a2ab4b07232c45e94097d5b3628bedd69d1914e5f31889f3","classification":"private-reference","expiresAt":"2026-07-21T23:10:00Z","inputId":"observedInventory","issuedAt":"2026-07-20T23:10:00Z","issuerRef":"service:synthetic-private-evidence","keyRef":"key:synthetic-private-evidence-v1","kind":"EvidenceAttestation","nonce":"0000000000000000000000000000000000000000000000000000000000000006","receiptDigest":"sha256:dddddddddddddddddddddddddddddddddddddddddddddddddddddddddddddddd","signatureBase64":"crHp1VxgbBCKxZAeL28zkSPyAFgGj9ywQSnLiw19WvzRYSw/FGWiyWUQnh3bNKovzQLfu2EZuNNpzYVy/n+ACQ=="},{"algorithm":"Ed25519","apiVersion":"modos.pleiades/v1alpha1","artifactDigest":"sha256:aaaaaaaaaaaaaaaaaaaaaaaaaaaaaaaaaaaaaaaaaaaaaaaaaaaaaaaaaaaaaaaa","artifactRef":"urn:pleiades:private:ecology:synthetic-0001","attestationId":"attestation:synthetic:privateEcology:v1","authority":{"attestationOnly":true,"authorizationApplied":false,"executionApplied":false},"candidateDigest":"sha256:63f923727ca0ab01a2ab4b07232c45e94097d5b3628bedd69d1914e5f31889f3","classification":"private-reference","expiresAt":"2026-07-21T23:10:00Z","inputId":"privateEcology","issuedAt":"2026-07-20T23:10:00Z","issuerRef":"service:synthetic-private-evidence","keyRef":"key:synthetic-private-evidence-v1","kind":"EvidenceAttestation","nonce":"0000000000000000000000000000000000000000000000000000000000000007","receiptDigest":"sha256:bbbbbbbbbbbbbbbbbbbbbbbbbbbbbbbbbbbbbbbbbbbbbbbbbbbbbbbbbbbbbbbb","signatureBase64":"y9pcKWCB6w/dp0M7mLhj4k/Jb5KnhbrRtp4ESdht3MbyaDpvpMvh0VKlOfzuku+Gp4Zcst16vgvgsQTAAls2DQ=="},{"algorithm":"Ed25519","apiVersion":"modos.pleiades/v1alpha1","artifactDigest":"sha256:1111111111111111111111111111111111111111111111111111111111111111","artifactRef":"urn:pleiades:receipt:signing-identity:synthetic-0001","attestationId":"attestation:synthetic:signingIdentity:v1","authority":{"attestationOnly":true,"authorizationApplied":false,"executionApplied":false},"candidateDigest":"sha256:63f923727ca0ab01a2ab4b07232c45e94097d5b3628bedd69d1914e5f31889f3","classification":"sovereign-decision","expiresAt":"2026-07-21T23:05:00Z","inputId":"signingIdentity","issuedAt":"2026-07-20T23:05:00Z","issuerRef":"human:synthetic-steward","keyRef":"key:synthetic-steward-v1","kind":"EvidenceAttestation","nonce":"0000000000000000000000000000000000000000000000000000000000000008","receiptDigest":"sha256:2222222222222222222222222222222222222222222222222222222222222222","signatureBase64":"+F+9Z2Xv3EGtcwfwKWDvUoULZ5XHbDDAfXeD8DiiAXs3Blo9sy5il0tmBElCvcUrHK6miHNEQUyyWo58fqh0DQ=="}]
